{
  "schema_version": "1.1.0",
  "project": {
    "id": "contexxxt",
    "name": "contexxxt",
    "repository": "https://github.com/Ragosorio/contexxxt"
  },
  "snapshot": {
    "id": "contexxxt.snapshot.0a0249cb8a12f541",
    "created_at": "2026-08-30T15:29:13.824Z",
    "as_of": "2026-08-30",
    "revision": {
      "commit": "8a2b12a56d3a52d5c426ce12999cbe842eb76a86",
      "dirty": true
    }
  },
  "evidence": [
    {
      "id": "ev.contexxxt.architecture",
      "type": "source_fragment",
      "summary": "The architecture contract separates deterministic retrieval from semantic task resolution.",
      "locator": {
        "uri": "docs/ARCHITECTURE.md"
      },
      "digest": "6d8eea9918385bf68b07cd7c11b9a95747af16663370895e246ffc7e14483151",
      "observed_at": "2026-08-28T23:15:00Z",
      "provider": {
        "id": "human",
        "capabilities_used": [
          "declared-architecture"
        ]
      },
      "authority": {
        "level": "governing",
        "subject": "core component boundaries"
      },
      "sensitivity": "public"
    },
    {
      "id": "ev.contexxxt.model-cli",
      "type": "source_fragment",
      "summary": "The public CLI declares model validate as the command that validates schema, IDs, and references.",
      "locator": {
        "uri": "packages/cli/src/commands.mjs",
        "symbol": "helpText"
      },
      "digest": "05bd700734ae6ff2c918a915b52ff90af43f24109a8bb6706ef253fbb880e5e0",
      "observed_at": "2026-08-29T22:12:47Z",
      "provider": {
        "id": "native",
        "capabilities_used": [
          "filesystem"
        ]
      },
      "authority": {
        "level": "authoritative",
        "subject": "public Project Model validation command"
      },
      "sensitivity": "public"
    },
    {
      "id": "ev.contexxxt.model-schema",
      "type": "source_fragment",
      "summary": "The packaged project-model.schema.json is the executable schema for Project Model version 1.1.0.",
      "locator": {
        "uri": "packages/cli/schemas/project-model.schema.json"
      },
      "digest": "2d15c456b5d0b6948e98969e1c426214600dd0046625e40aa1d1a92a5de61acd",
      "observed_at": "2026-08-29T22:12:47Z",
      "provider": {
        "id": "native",
        "capabilities_used": [
          "filesystem"
        ]
      },
      "authority": {
        "level": "authoritative",
        "subject": "executable Project Model shape"
      },
      "sensitivity": "public"
    },
    {
      "id": "ev.contexxxt.model-validation-code",
      "type": "repository_fact",
      "summary": "The model runtime resolves the canonical path and validates schema plus semantic references before use.",
      "locator": {
        "uri": "packages/cli/src/model/model.mjs",
        "symbol": "validateProjectModel"
      },
      "digest": "c18bb5a092d5c55b5133feeeccf16d9745118c7179f712deb0bf22d7bb014bb7",
      "observed_at": "2026-08-29T22:12:47Z",
      "provider": {
        "id": "native",
        "capabilities_used": [
          "filesystem"
        ]
      },
      "authority": {
        "level": "authoritative",
        "subject": "implemented Project Model validation behavior"
      },
      "sensitivity": "public"
    },
    {
      "id": "ev.contexxxt.product",
      "type": "source_fragment",
      "summary": "The product contract defines contexxxt as an adaptive context and behavior compiler.",
      "locator": {
        "uri": "docs/PRODUCT.md"
      },
      "digest": "c647e3b6c9fc383fba5c20af20a57723a59d89cd86647422481b5f5e4ea7aabd",
      "observed_at": "2026-08-28T18:00:00Z",
      "provider": {
        "id": "native",
        "capabilities_used": [
          "filesystem"
        ]
      },
      "authority": {
        "level": "governing",
        "subject": "product contract"
      },
      "sensitivity": "public"
    },
    {
      "id": "ev.contexxxt.project-model",
      "type": "source_fragment",
      "summary": "The Project Model specification defines canonical knowledge, provenance, scope, and validity.",
      "locator": {
        "uri": "docs/PROJECT_MODEL.md"
      },
      "digest": "da011e6beb713b96c7c4dc163e18b1f4d1e24ba36142b41b06d289ae59980b1d",
      "observed_at": "2026-08-29T22:12:47Z",
      "provider": {
        "id": "native",
        "capabilities_used": [
          "filesystem"
        ]
      },
      "authority": {
        "level": "governing",
        "subject": "Project Model contract"
      },
      "sensitivity": "public"
    },
    {
      "id": "ev.contexxxt.query-code",
      "type": "repository_fact",
      "summary": "The CLI implements deterministic, budgeted query and target-context retrieval.",
      "locator": {
        "uri": "packages/cli/src/query/query.mjs"
      },
      "digest": "f50e471ef8580b26972d57d5a197a76300096de56e634d784789bae83400488a",
      "observed_at": "2026-08-28T18:00:00Z",
      "provider": {
        "id": "native",
        "capabilities_used": [
          "filesystem"
        ]
      },
      "authority": {
        "level": "authoritative",
        "subject": "implemented query behavior"
      },
      "sensitivity": "public"
    },
    {
      "id": "ev.contexxxt.query-tests",
      "type": "test_result",
      "summary": "Deterministic fixtures test lookup, scopes, status, conflicts, budgets, ordering, and reproducibility.",
      "locator": {
        "uri": "packages/cli/test/model-query.test.mjs"
      },
      "digest": "f2412700c97117408c1abf71e934efee0722a2e8edf3bf484012a647c442795d",
      "observed_at": "2026-08-28T18:00:00Z",
      "provider": {
        "id": "native",
        "capabilities_used": [
          "tests"
        ]
      },
      "authority": {
        "level": "supporting",
        "subject": "Query Layer verification"
      },
      "sensitivity": "public"
    },
    {
      "id": "inspection.ci.ci.command.211e2283fe8a",
      "type": "repository_fact",
      "summary": ".github/workflows/ci.yml declares a CI run command; it was not executed.",
      "observation": {
        "category": "ci",
        "key": "ci.command",
        "value": "{\"command\":\"pnpm build\",\"workflow\":\".github/workflows/ci.yml\"}"
      },
      "locator": {
        "uri": ".github/workflows/ci.yml",
        "symbol": "run.1"
      },
      "digest": "702e948d947e109310cb2bf19c157b5bb8142b88c87e02ae87a7594c9b797893",
      "observed_at": "2026-08-29T22:40:33.303Z",
      "provider": {
        "id": "native",
        "version": "0.2.0-rc.1",
        "capabilities_used": [
          "ci"
        ]
      },
      "coverage": {
        "status": "complete",
        "scopes": [
          {
            "kind": "directory",
            "value": ".github/workflows"
          }
        ]
      },
      "authority": {
        "level": "observational",
        "subject": "ci.command"
      },
      "sensitivity": "public",
      "revision": {
        "commit": "8a2b12a56d3a52d5c426ce12999cbe842eb76a86",
        "branch": "main",
        "dirty": true
      }
    },
    {
      "id": "inspection.ci.ci.command.2fa43c9255b6",
      "type": "repository_fact",
      "summary": ".github/workflows/ci.yml declares a CI run command; it was not executed.",
      "observation": {
        "category": "ci",
        "key": "ci.command",
        "value": "{\"command\":\"pnpm --filter contexxxt pack --pack-destination /tmp\",\"workflow\":\".github/workflows/ci.yml\"}"
      },
      "locator": {
        "uri": ".github/workflows/ci.yml",
        "symbol": "run.0"
      },
      "digest": "364233793e6d8972906cd1a4b09180e7d825af2111a012bf3e4f09dfc1bc1cc4",
      "observed_at": "2026-08-29T22:40:33.303Z",
      "provider": {
        "id": "native",
        "version": "0.2.0-rc.1",
        "capabilities_used": [
          "ci"
        ]
      },
      "coverage": {
        "status": "complete",
        "scopes": [
          {
            "kind": "directory",
            "value": ".github/workflows"
          }
        ]
      },
      "authority": {
        "level": "observational",
        "subject": "ci.command"
      },
      "sensitivity": "public",
      "revision": {
        "commit": "8a2b12a56d3a52d5c426ce12999cbe842eb76a86",
        "branch": "main",
        "dirty": true
      }
    },
    {
      "id": "inspection.ci.ci.command.4559d3ecc063",
      "type": "repository_fact",
      "summary": ".github/workflows/ci.yml declares a CI run command; it was not executed.",
      "observation": {
        "category": "ci",
        "key": "ci.command",
        "value": "{\"command\":\"pnpm install --frozen-lockfile\",\"workflow\":\".github/workflows/ci.yml\"}"
      },
      "locator": {
        "uri": ".github/workflows/ci.yml",
        "symbol": "run.3"
      },
      "digest": "f733afb2da73a36bd48778fd7502436e384741ad191367d97182afc4909130a5",
      "observed_at": "2026-08-29T22:40:33.303Z",
      "provider": {
        "id": "native",
        "version": "0.2.0-rc.1",
        "capabilities_used": [
          "ci"
        ]
      },
      "coverage": {
        "status": "complete",
        "scopes": [
          {
            "kind": "directory",
            "value": ".github/workflows"
          }
        ]
      },
      "authority": {
        "level": "observational",
        "subject": "ci.command"
      },
      "sensitivity": "public",
      "revision": {
        "commit": "8a2b12a56d3a52d5c426ce12999cbe842eb76a86",
        "branch": "main",
        "dirty": true
      }
    },
    {
      "id": "inspection.ci.ci.command.5e81455ae9c1",
      "type": "repository_fact",
      "summary": ".github/workflows/ci.yml declares a CI run command; it was not executed.",
      "observation": {
        "category": "ci",
        "key": "ci.command",
        "value": "{\"command\":\"pnpm check\",\"workflow\":\".github/workflows/ci.yml\"}"
      },
      "locator": {
        "uri": ".github/workflows/ci.yml",
        "symbol": "run.2"
      },
      "digest": "6552223b93659279b99845a67f2dc3857e0bc30551e3dbb79340dd13bfe18dde",